{
  "$schema": "https://json-schema.org/draft/2020-12/schema",
  "$id": "https://innsigle.dev/schema/session-provenance/v1.json",
  "title": "Innsigle session provenance document v1",
  "type": "object",
  "additionalProperties": true,
  "required": [
    "innsigle_provenance",
    "kind",
    "schema_version",
    "generated_at",
    "generator",
    "metrics",
    "composition_suggestion",
    "artifacts",
    "privacy"
  ],
  "properties": {
    "innsigle_provenance": { "const": "1" },
    "kind": { "const": "session" },
    "schema_version": { "const": "1" },
    "generated_at": { "type": "string", "minLength": 1 },
    "generator": {
      "type": "object",
      "required": ["name", "version"],
      "properties": {
        "name": { "type": "string" },
        "version": { "type": "string" },
        "uri": { "type": ["string", "null"] }
      }
    },
    "session": {
      "type": "object",
      "properties": {
        "id": { "type": "string" },
        "started_at": { "type": "string" },
        "ended_at": { "type": "string" },
        "harness": { "type": "object" }
      }
    },
    "composition_suggestion": {
      "enum": ["human-authored", "mixed", "model-primary"]
    },
    "metrics": {
      "type": "object",
      "required": ["user_prompts", "assistant_turns"],
      "properties": {
        "user_prompts": { "type": "integer", "minimum": 0 },
        "assistant_turns": { "type": "integer", "minimum": 0 },
        "tool_calls": { "type": "integer", "minimum": 0 },
        "skill_invocations": { "type": "integer", "minimum": 0 },
        "files_touched": { "type": "integer", "minimum": 0 },
        "approx_input_tokens": { "type": ["integer", "null"] },
        "approx_output_tokens": { "type": ["integer", "null"] }
      }
    },
    "human_input": {
      "type": ["object", "null"],
      "required": ["method", "basis", "percent", "weights", "direction", "contribution", "review"],
      "properties": {
        "method": { "const": "hi1" },
        "basis": { "const": "session-journal" },
        "percent": { "type": "integer", "minimum": 0, "maximum": 100 },
        "weights": {
          "type": "object",
          "required": ["direction", "contribution", "review"],
          "properties": {
            "direction": { "type": "integer", "minimum": 0 },
            "contribution": { "type": "integer", "minimum": 0 },
            "review": { "type": "integer", "minimum": 0 }
          }
        },
        "direction": {
          "type": ["object", "null"],
          "required": ["percent", "user_prompts", "model_write_bursts"],
          "properties": {
            "percent": { "type": "integer", "minimum": 0, "maximum": 100 },
            "user_prompts": { "type": "integer", "minimum": 0 },
            "model_write_bursts": { "type": "integer", "minimum": 0 }
          }
        },
        "contribution": {
          "type": "object",
          "required": ["percent", "human_chars", "model_chars", "human_write_events", "coverage"],
          "properties": {
            "percent": { "type": "integer", "minimum": 0, "maximum": 100 },
            "human_chars": { "type": "integer", "minimum": 0 },
            "model_chars": { "type": "integer", "minimum": 0 },
            "human_write_events": { "type": "integer", "minimum": 0 },
            "coverage": { "enum": ["full", "partial"] }
          }
        },
        "review": {
          "type": ["object", "null"],
          "required": ["percent", "post_output_prompts", "review_events"],
          "properties": {
            "percent": { "type": "integer", "minimum": 0, "maximum": 100 },
            "post_output_prompts": { "type": "integer", "minimum": 0 },
            "review_events": { "type": "integer", "minimum": 0 }
          }
        }
      }
    },
    "models": { "type": "array" },
    "skills": { "type": "array" },
    "tools": { "type": "array" },
    "humans": { "type": "array" },
    "artifacts": {
      "type": "array",
      "minItems": 1,
      "items": {
        "type": "object",
        "required": ["digest"],
        "properties": {
          "path": { "type": "string" },
          "digest": {
            "type": "object",
            "required": ["alg", "value"],
            "properties": {
              "alg": { "const": "sha256" },
              "value": { "type": "string", "pattern": "^[0-9a-f]{64}$" }
            }
          },
          "role": { "type": "string" }
        }
      }
    },
    "timeline": { "type": "array" },
    "transcript": {
      "type": ["object", "null"],
      "properties": {
        "digest": { "type": "object" },
        "uri": { "type": "string" }
      }
    },
    "privacy": {
      "type": "object",
      "required": ["redacted"],
      "properties": {
        "redacted": { "type": "boolean" },
        "raw_retained_locally": { "type": "boolean" },
        "notes": { "type": ["string", "null"] }
      }
    }
  }
}
